{
  "schema_version": "3.0.0",
  "id": "r3-c04",
  "rank": 3,
  "class_number": 4,
  "constant_id": 4,
  "scope": {
    "symmetrizer": "identity",
    "leading_permutation": "identity",
    "indecomposable": true
  },
  "index_base": 0,
  "datum": {
    "delays": [
      6,
      2,
      6
    ],
    "N_plus": [
      [
        [],
        [],
        []
      ],
      [
        [],
        [],
        []
      ],
      [
        [],
        [
          [
            1,
            3
          ]
        ],
        []
      ]
    ],
    "N_minus": [
      [
        [],
        [],
        [
          [
            1,
            1
          ]
        ]
      ],
      [
        [],
        [],
        [
          [
            1,
            1
          ]
        ]
      ],
      [
        [
          [
            1,
            5
          ]
        ],
        [
          [
            1,
            1
          ],
          [
            1,
            5
          ]
        ],
        []
      ]
    ],
    "A_plus_1": [
      [
        2,
        0,
        0
      ],
      [
        0,
        2,
        0
      ],
      [
        0,
        -1,
        2
      ]
    ],
    "A_minus_1": [
      [
        2,
        0,
        -1
      ],
      [
        0,
        2,
        -1
      ],
      [
        -1,
        -2,
        2
      ]
    ]
  },
  "family": {
    "parameters": [
      "lambda",
      "s1",
      "s2"
    ],
    "fixed_shift": {
      "species": 2,
      "value": "0"
    },
    "dimension": 3,
    "rref": [
      [
        "1",
        "0",
        "0",
        "0",
        "0",
        "0",
        "0",
        "3/2",
        "-3/2"
      ],
      [
        "0",
        "1",
        "0",
        "0",
        "0",
        "0",
        "0",
        "1/2",
        "-1/2"
      ],
      [
        "0",
        "0",
        "1",
        "0",
        "0",
        "0",
        "0",
        "3/2",
        "-3/2"
      ],
      [
        "0",
        "0",
        "0",
        "1",
        "0",
        "0",
        "0",
        "-1/2",
        "-1/2"
      ],
      [
        "0",
        "0",
        "0",
        "0",
        "1",
        "0",
        "1",
        "3/2",
        "-3/2"
      ],
      [
        "0",
        "0",
        "0",
        "0",
        "0",
        "1",
        "0",
        "3/2",
        "-1/2"
      ]
    ],
    "variable_names": [
      "r0",
      "r1",
      "r2",
      "p0_21_0",
      "p1_02_0",
      "p1_12_0",
      "p1_20_0",
      "p1_21_0",
      "p1_21_1"
    ],
    "representative_values": [
      6,
      2,
      6,
      3,
      1,
      1,
      5,
      1,
      5
    ],
    "coverage": {
      "id": 4,
      "file": "004_no_lift_outside_family.smt2",
      "result": "unsat",
      "sha256": "840e63d250e154ac603f865797ce564b37fe642ff51c3197437d42206e2162a5"
    }
  },
  "periodicity": {
    "time_coordinate": "displayed representative",
    "h_plus": 6,
    "h_minus": 14,
    "labelled_period": 20,
    "positive_negative_permutation": [
      0,
      1,
      2,
      3,
      4,
      5,
      6,
      7,
      8,
      9,
      10,
      11,
      12,
      13
    ],
    "negative_negative_permutation": [
      0,
      1,
      2,
      3,
      4,
      5,
      6,
      7,
      8,
      9,
      10,
      11,
      12,
      13
    ]
  },
  "exchange": {
    "vertices": [
      [
        0,
        0
      ],
      [
        0,
        1
      ],
      [
        0,
        2
      ],
      [
        0,
        3
      ],
      [
        0,
        4
      ],
      [
        0,
        5
      ],
      [
        1,
        0
      ],
      [
        1,
        1
      ],
      [
        2,
        0
      ],
      [
        2,
        1
      ],
      [
        2,
        2
      ],
      [
        2,
        3
      ],
      [
        2,
        4
      ],
      [
        2,
        5
      ]
    ],
    "B": [
      [
        0,
        0,
        0,
        0,
        0,
        0,
        0,
        0,
        0,
        0,
        0,
        0,
        0,
        -1
      ],
      [
        0,
        0,
        0,
        0,
        0,
        0,
        0,
        0,
        1,
        0,
        0,
        0,
        0,
        0
      ],
      [
        0,
        0,
        0,
        0,
        0,
        0,
        0,
        0,
        0,
        1,
        0,
        0,
        0,
        0
      ],
      [
        0,
        0,
        0,
        0,
        0,
        0,
        0,
        0,
        0,
        0,
        1,
        0,
        0,
        0
      ],
      [
        0,
        0,
        0,
        0,
        0,
        0,
        0,
        0,
        0,
        0,
        0,
        1,
        0,
        0
      ],
      [
        0,
        0,
        0,
        0,
        0,
        0,
        0,
        0,
        0,
        0,
        0,
        0,
        1,
        0
      ],
      [
        0,
        0,
        0,
        0,
        0,
        0,
        0,
        0,
        0,
        -1,
        0,
        1,
        0,
        -1
      ],
      [
        0,
        0,
        0,
        0,
        0,
        0,
        0,
        0,
        1,
        0,
        -1,
        0,
        1,
        0
      ],
      [
        0,
        -1,
        0,
        0,
        0,
        0,
        0,
        -1,
        0,
        0,
        0,
        0,
        0,
        0
      ],
      [
        0,
        0,
        -1,
        0,
        0,
        0,
        1,
        0,
        0,
        0,
        0,
        -1,
        0,
        0
      ],
      [
        0,
        0,
        0,
        -1,
        0,
        0,
        0,
        1,
        0,
        0,
        0,
        0,
        -1,
        0
      ],
      [
        0,
        0,
        0,
        0,
        -1,
        0,
        -1,
        0,
        0,
        1,
        0,
        0,
        0,
        0
      ],
      [
        0,
        0,
        0,
        0,
        0,
        -1,
        0,
        -1,
        0,
        0,
        1,
        0,
        0,
        0
      ],
      [
        1,
        0,
        0,
        0,
        0,
        0,
        1,
        0,
        0,
        0,
        0,
        0,
        0,
        0
      ]
    ],
    "mutation_vertices": [
      0,
      6,
      8
    ],
    "relabel_old_to_new": [
      5,
      0,
      1,
      2,
      3,
      4,
      7,
      6,
      13,
      8,
      9,
      10,
      11,
      12
    ]
  },
  "slice": {
    "components": 2,
    "vertices": 7,
    "B": [
      [
        0,
        0,
        0,
        0,
        0,
        0,
        -1
      ],
      [
        0,
        0,
        0,
        0,
        1,
        0,
        0
      ],
      [
        0,
        0,
        0,
        0,
        0,
        1,
        0
      ],
      [
        0,
        0,
        0,
        0,
        -1,
        1,
        -1
      ],
      [
        0,
        -1,
        0,
        1,
        0,
        -1,
        0
      ],
      [
        0,
        0,
        -1,
        -1,
        1,
        0,
        0
      ],
      [
        1,
        0,
        0,
        1,
        0,
        0,
        0
      ]
    ],
    "mutation_word": [
      0,
      3,
      4
    ],
    "relabel_old_to_new": [
      2,
      0,
      1,
      3,
      6,
      4,
      5
    ],
    "canonical_signature": [
      1,
      3,
      3,
      0,
      -1,
      -1,
      1,
      0,
      0,
      0,
      1,
      0,
      0,
      -1,
      -1,
      0,
      0,
      1,
      0,
      0,
      0,
      0,
      -1,
      0,
      -1,
      1,
      0,
      0,
      0,
      0,
      -1,
      0,
      1,
      0,
      0,
      0,
      0,
      0,
      0,
      0,
      1,
      0,
      0,
      0,
      0,
      0,
      0,
      0,
      1,
      0,
      0,
      0
    ],
    "signature_sha256": "d8960bb15eeda7ad3ef41f5b5c7278f370ffcef191f023f60967c226d6cadce7"
  },
  "provenance": {
    "source_commit": "72c78d0a8a8f1a5bcfc40998707e26e34cc82aa9",
    "verification_kind": "computer-assisted",
    "sources": [
      {
        "path": "research/rank3/lift_feasibility.jsonl",
        "role": "polynomial witnesses",
        "sha256": "2edeb36cb2f85e5c7cf13f86582ac521c072d3706a0e3d0c13c621952b3dce7f"
      },
      {
        "path": "research/rank3/lift_spaces.json",
        "role": "complete lift families",
        "sha256": "6197d411dcc83d57fdfb40b488d26d58237c28769ce2ccced23ca42b4a2b6b85"
      },
      {
        "path": "research/rank3/constant_candidates.json",
        "role": "independent constant matrices",
        "sha256": "188ed99d603e90040bee7b5a959d5260e2feb69ec22ce1556e8bf90f7bb52a43"
      },
      {
        "path": "research/rank3/verification.json",
        "role": "exclusion and coverage replay",
        "sha256": "cf9685a6b994e8cea283325d313489050dbe0a51c605cd1c1abfecb23728aa3a"
      },
      {
        "path": "research/rank3/slice_signatures.json",
        "role": "slice equivalence certificates",
        "sha256": "e320464f2f5c59b2fcb8c3af9f063562e78ccc35a6af0685ddbe699d18cdd08c"
      }
    ],
    "manuscript": "research/rank3/rank3-classification.tex",
    "pdf": "docs/proofs/rank3-classification.pdf",
    "query_path": "research/rank3/smt_queries/004_no_lift_outside_family.smt2",
    "query_member": "004_no_lift_outside_family.smt2",
    "enrichment_commit": "72c78d0a8a8f1a5bcfc40998707e26e34cc82aa9",
    "enrichment_sources": [
      {
        "path": "research/catalogue/spectral-data.json",
        "role": "certified exponent multiplicities and exact matrix ratios",
        "sha256": "fb64bd1cab92b318556018e560026f65924e42310880cb4c2785a01474cf263b"
      },
      {
        "path": "research/catalogue/family-notes.json",
        "role": "named family matches",
        "sha256": "8082d2f552a687182b9013eeef3a3154abd2026cc12df3b20d8a7a25f94553e1"